{
  "version": "DovetEvent/1",
  "id": "event_example_1",
  "runId": "run_example_1",
  "sequence": 1,
  "type": "run.interrupted",
  "source": "system",
  "knowledge": "observed",
  "observedAt": "2026-09-13T00:00:00Z",
  "payload": {
    "illustrative": true,
    "reason": "demonstration_fault"
  }
}
